{
  "allowed_claims": [
    "Raw sector ledger collapses to the projected 1D finite-frequency source under xxx projection."
  ],
  "blocking_issues": [],
  "forbidden_claims": [
    "Full reduced sigma_xxx kernel equality has been proven from tensorial sigma_abc.",
    "Tensorial simplification has started."
  ],
  "mathematical_status": {
    "exact_reconstruction": true,
    "overclaim_detected": false,
    "regression_preserved": true,
    "simplification_real": false
  },
  "next_action": "FREEZE",
  "nonblocking_caveats": [
    "Stage 001b caveat preserved: DCProjectionTo1D is INHERITED_PASS from finite-frequency xxx projection plus the archived 1D DC notebook pipeline, not a direct full tensorial DC-series PASS."
  ],
  "patch_instructions": [],
  "review_scope": "routine_branch",
  "reviewer_role": "PhysicsReviewer",
  "source_review_files": [
    "review_packet.md",
    "validation/validation_summary.json"
  ],
  "stage_name": "005_sector_ledger_xxx_collapse_regression",
  "suggested_next_stage": null,
  "verdict": "PASS_WITH_CAVEAT"
}
