{
  "allowed_claims": [
    "The raw sigma_abc contract defines the required tensorial scope.",
    "The sigma_xxx projection benchmark is registered as a future protected regression."
  ],
  "blocking_issues": [],
  "forbidden_claims": [
    "The tensorial raw expression is available.",
    "The full tensorial conductivity formula is correct.",
    "The projected sigma_xxx simplifications have been promoted to tensorial identities."
  ],
  "mathematical_status": {
    "exact_reconstruction": true,
    "overclaim_detected": false,
    "regression_preserved": true,
    "simplification_real": false
  },
  "next_action": "FREEZE",
  "nonblocking_caveats": [
    "The branch is a contract and benchmark-registration checkpoint only.",
    "The next scientific branch must select a raw source before import."
  ],
  "patch_instructions": [],
  "review_scope": "routine_branch",
  "reviewer_role": "PhysicsReviewer",
  "source_review_files": [
    "review_packet.md",
    "raw/RAW_SIGMA_ABC_CONTRACT.md",
    "benchmarks/sigma_xxx_projection_benchmark.md"
  ],
  "stage_name": "000_raw_contract",
  "suggested_next_stage": "sigma_abc_001_raw_generation_or_transcription",
  "verdict": "PASS_WITH_CAVEAT"
}

