{
  "allowed_claims": [
    "The raw contract, template, source options, and benchmark registration files exist.",
    "The validation summary honestly records raw absence."
  ],
  "blocking_issues": [],
  "forbidden_claims": [
    "A generated raw_sigma_abc.wl file is present.",
    "A downstream simplification stage has been executed."
  ],
  "mathematical_status": {
    "exact_reconstruction": true,
    "overclaim_detected": false,
    "regression_preserved": true,
    "simplification_real": false
  },
  "next_action": "FREEZE",
  "nonblocking_caveats": [
    "Freeze is acceptable only as a contract checkpoint, not as raw import."
  ],
  "patch_instructions": [],
  "review_scope": "routine_branch",
  "reviewer_role": "SoftwareReviewer",
  "source_review_files": [
    "review_packet.md",
    "raw/raw_sigma_abc.template.wl",
    "validation/validation_summary.json"
  ],
  "stage_name": "000_raw_contract",
  "suggested_next_stage": "sigma_abc_001_raw_generation_or_transcription",
  "verdict": "PASS_WITH_CAVEAT"
}
