{
  "allowed_claims": [
    "Raw contract readiness is validated.",
    "RawSigmaABCExists is explicitly false.",
    "SigmaXXXBenchmarkRegistered is true."
  ],
  "blocking_issues": [],
  "forbidden_claims": [
    "raw_sigma_abc.wl exists.",
    "sigma_abc simplification has started."
  ],
  "mathematical_status": {
    "exact_reconstruction": true,
    "overclaim_detected": false,
    "regression_preserved": true,
    "simplification_real": false
  },
  "next_action": "FREEZE",
  "nonblocking_caveats": [
    "No algebraic simplification was expected or performed in this contract stage.",
    "The sigma_xxx projection benchmark is registered but not run because no raw tensorial expression exists."
  ],
  "patch_instructions": [],
  "review_scope": "routine_branch",
  "reviewer_role": "AlgebraReviewer",
  "source_review_files": [
    "review_packet.md",
    ".loop/validation_summary.json"
  ],
  "stage_name": "000_raw_contract",
  "suggested_next_stage": "sigma_abc_001_raw_generation_or_transcription",
  "verdict": "PASS_WITH_CAVEAT"
}

